{
  "$schema": "../schemas/component-catalog.schema.json",
  "version": "0.1.0-alpha.0",
  "distribution": "shadcn-source",
  "behaviorEngine": "@base-ui/react@1.7.0",
  "defaultTheme": "neutral",
  "optionalThemes": ["tis"],
  "guides": [],
  "blocks": [
    {
      "name": "dashboard-overview",
      "title": "Dashboard Overview",
      "category": "dashboard",
      "description": "A responsive product dashboard with metrics, an accessible trend chart and recent activity.",
      "files": ["src/blocks/dashboard-overview.tsx"],
      "registryDependencies": ["badge", "button", "card", "chart", "table"],
      "accessibility": "Includes a labelled chart with an accessibility layer, a named activity table and a heading-led page hierarchy."
    },
    {
      "name": "login-page",
      "title": "Login Page",
      "category": "authentication",
      "description": "A complete sign-in surface with native form semantics, password recovery and account access guidance.",
      "files": ["src/blocks/login-page.tsx"],
      "registryDependencies": ["button", "card", "checkbox", "field", "input"],
      "accessibility": "Uses native labelled inputs, autocomplete attributes, a submit button and visible recovery links."
    },
    {
      "name": "settings-page",
      "title": "Settings Page",
      "category": "settings",
      "description": "A responsive workspace settings form for identity, localization and notification preferences.",
      "files": ["src/blocks/settings-page.tsx"],
      "registryDependencies": ["button", "card", "field", "input", "native-select", "separator", "switch"],
      "accessibility": "Groups visible labels, descriptions and native form controls in a predictable keyboard order."
    },
    {
      "name": "team-members",
      "title": "Team Members",
      "category": "team",
      "description": "A member management card with identity, role, status and explicit row actions.",
      "files": ["src/blocks/team-members.tsx"],
      "registryDependencies": ["avatar", "badge", "button", "card"],
      "accessibility": "Every member action has a unique accessible name and status remains available as text."
    }
  ],
  "charts": [
    {
      "name": "chart-recipes",
      "title": "Chart Recipes",
      "category": "data-visualization",
      "description": "Six token-aware and accessible Recharts recipes: Area, Bar, Line, Pie, Radar and Radial.",
      "files": ["src/charts/chart-recipes.tsx"],
      "registryDependencies": ["chart"],
      "accessibility": "Every chart has an accessible name, Recharts accessibility layer and a concise text summary of the data."
    }
  ],
  "components": [
    {
      "name": "accordion",
      "title": "Accordion",
      "category": "disclosure",
      "description": "A vertically stacked set of interactive headings that reveal content.",
      "files": ["src/components/ui/accordion.tsx"],
      "accessibility": "Base UI connects headings, triggers and panels; Enter and Space toggle a panel while Tab follows normal document order."
    },
    {
      "name": "alert",
      "title": "Alert",
      "category": "feedback",
      "description": "A static status message with optional title, icon and action.",
      "files": ["src/components/ui/alert.tsx"],
      "accessibility": "Uses role=alert; reserve it for content that should be announced immediately."
    },
    {
      "name": "alert-dialog",
      "title": "Alert Dialog",
      "category": "overlay",
      "description": "A modal confirmation surface for important or destructive decisions.",
      "files": ["src/components/ui/alert-dialog.tsx"],
      "registryDependencies": ["button"],
      "accessibility": "Always provide a title and description; Base UI traps focus and requires an explicit response."
    },
    {
      "name": "aspect-ratio",
      "title": "Aspect Ratio",
      "category": "layout",
      "description": "A layout primitive that preserves a fixed width-to-height ratio.",
      "files": ["src/components/ui/aspect-ratio.tsx"],
      "accessibility": "The wrapper is presentational; provide appropriate semantics and alternative text for its content."
    },
    {
      "name": "attachment",
      "title": "Attachment",
      "category": "data-display",
      "description": "A file attachment surface with media, metadata, actions and an optional trigger.",
      "files": ["src/components/ui/attachment.tsx"],
      "registryDependencies": ["button"],
      "accessibility": "Use descriptive filenames, expose file type and size in text, and label icon-only actions."
    },
    {
      "name": "avatar",
      "title": "Avatar",
      "category": "data-display",
      "description": "A user or entity image with fallback, badge and grouping support.",
      "files": ["src/components/ui/avatar.tsx"],
      "accessibility": "Provide meaningful alt text for informative images and always include AvatarFallback."
    },
    {
      "name": "badge",
      "title": "Badge",
      "category": "data-display",
      "description": "A compact label for status, category or metadata.",
      "files": ["src/components/ui/badge.tsx", "src/components/ui/badge.variants.ts"],
      "accessibility": "Decorative badges must not be the only way status is communicated."
    },
    {
      "name": "breadcrumb",
      "title": "Breadcrumb",
      "category": "navigation",
      "description": "A hierarchical path that locates the current page within a structure.",
      "files": ["src/components/ui/breadcrumb.tsx"],
      "accessibility": "Uses a named breadcrumb navigation landmark and aria-current on the current page."
    },
    {
      "name": "bubble",
      "title": "Bubble",
      "category": "data-display",
      "description": "A conversational content surface with alignment and reaction support.",
      "files": ["src/components/ui/bubble.tsx"],
      "accessibility": "Keep sender and timing information available in text and preserve chronological reading order."
    },
    {
      "name": "button",
      "title": "Button",
      "category": "action",
      "description": "A primary action primitive with visual variants and sizes.",
      "files": ["src/components/ui/button.tsx", "src/components/ui/button.variants.ts"],
      "accessibility": "Base UI preserves native button semantics, disabled state and keyboard activation."
    },
    {
      "name": "button-group",
      "title": "Button Group",
      "category": "action",
      "description": "A visual and semantic grouping for closely related actions or controls.",
      "files": ["src/components/ui/button-group.tsx", "src/components/ui/button-group.variants.ts"],
      "registryDependencies": ["separator"],
      "accessibility": "Provide an accessible label for the group when the relationship is not clear from context."
    },
    {
      "name": "calendar",
      "title": "Calendar",
      "category": "form-control",
      "description": "A date selection calendar with single, multiple and range modes.",
      "files": ["src/components/ui/calendar.tsx"],
      "dependencies": ["react-day-picker@10.0.1", "date-fns@4.4.0"],
      "registryDependencies": ["button"],
      "accessibility": "Provide a visible purpose and date format; React DayPicker manages the calendar grid and keyboard navigation."
    },
    {
      "name": "card",
      "title": "Card",
      "category": "layout",
      "description": "A compositional surface for grouped content and actions.",
      "files": ["src/components/ui/card.tsx"],
      "accessibility": "Choose semantic children and headings based on the content hierarchy."
    },
    {
      "name": "carousel",
      "title": "Carousel",
      "category": "data-display",
      "description": "A keyboard-operable sequence of slides powered by Embla Carousel.",
      "files": [
        "src/components/ui/carousel.ts",
        "src/components/ui/carousel.components.tsx",
        "src/components/ui/carousel.context.ts",
        "src/components/ui/carousel.types.ts"
      ],
      "dependencies": ["embla-carousel-react@8.6.0"],
      "registryDependencies": ["button"],
      "accessibility": "Name the carousel and every slide, provide Previous and Next as non-drag controls, and do not capture arrow keys from interactive slide content."
    },
    {
      "name": "chart",
      "title": "Chart",
      "category": "data-display",
      "description": "Token-aware wrappers, tooltip and legend utilities for Recharts visualizations.",
      "files": ["src/components/ui/chart.tsx"],
      "dependencies": ["recharts@3.8.0"],
      "registryDependencies": ["card"],
      "accessibility": "Provide a textual summary or data table and never rely on color alone to distinguish series."
    },
    {
      "name": "checkbox",
      "title": "Checkbox",
      "category": "form-control",
      "description": "A binary or mixed-state selection control.",
      "files": ["src/components/ui/checkbox.tsx"],
      "accessibility": "Pair with FieldLabel; Base UI manages checked, indeterminate and disabled states."
    },
    {
      "name": "collapsible",
      "title": "Collapsible",
      "category": "disclosure",
      "description": "A trigger that reveals or hides a single region of related content.",
      "files": ["src/components/ui/collapsible.tsx"],
      "accessibility": "Base UI connects the trigger and panel with expanded and controlled-region state while preserving trigger focus."
    },
    {
      "name": "combobox",
      "title": "Combobox",
      "category": "form-control",
      "description": "A searchable single or multiple selection input with listbox behavior.",
      "files": [
        "src/components/ui/combobox.ts",
        "src/components/ui/combobox.components.tsx",
        "src/components/ui/combobox.hooks.ts"
      ],
      "registryDependencies": ["button", "input-group"],